<?xml version="1.0" encoding="UTF-8"?>
<Appointment xmlns:xsi="http://www.w3.org/2001/XMLSchema-instance" 
xsi:noNamespaceSchemaLocation="Appointment.xsd">

  <Patient>
    <Patient_name>Harshita Singh</Patient_name>
    <Patient_id>01</Patient_id>
    <Doctor_name>Dr. Manish Malhotra</Doctor_name>
    <Doctor_id>91</Doctor_id>
    <Appointment_date>2021-09-11</Appointment_date>
    <Appointment_time>13:00:00</Appointment_time>
    <Patient_gender>female</Patient_gender>
  </Patient>
  
  <Patient>
    <Patient_name>Prateek Kukkad</Patient_name>
    <Patient_id>02</Patient_id>
    <Doctor_name>Dr. Aishwarya Rai</Doctor_name>
    <Doctor_id>92</Doctor_id>
    <Appointment_date>2022-01-13</Appointment_date>
    <Appointment_time>10:30:00</Appointment_time>
    <Patient_gender>male</Patient_gender>
  </Patient>
  
  <Patient>
    <Patient_name>Kanika Arora</Patient_name>
    <Patient_id>03</Patient_id>
    <Doctor_name>Dr. Manish Malhotra</Doctor_name>
    <Doctor_id>91</Doctor_id>
    <Appointment_date>2022-10-12</Appointment_date>
    <Appointment_time>15:30:00</Appointment_time>
    <Patient_gender>female</Patient_gender>
  </Patient>
  
  <Patient>
    <Patient_name>Aastha Singhania</Patient_name>
    <Patient_id>04</Patient_id>
    <Doctor_name>Dr. Elizabeth Quith</Doctor_name>
    <Doctor_id>93</Doctor_id>
    <Appointment_date>2021-09-11</Appointment_date>
    <Appointment_time>13:00:00</Appointment_time>
    <Patient_gender>female</Patient_gender>
  </Patient>
  
  <Patient>
    <Patient_name>Yukta Singh</Patient_name>
    <Patient_id>05</Patient_id>
    <Doctor_name>Dr. Manish Malhotra</Doctor_name>
    <Doctor_id>91</Doctor_id>
    <Appointment_date>2022-01-12</Appointment_date>
    <Appointment_time>17:00:00</Appointment_time>
    <Patient_gender>female</Patient_gender>
  </Patient>
  
  <Patient>
    <Patient_name>Harshit Kumar</Patient_name>
    <Patient_id>06</Patient_id>
    <Doctor_name>Dr. AK Verma</Doctor_name>
    <Doctor_id>95</Doctor_id>
    <Appointment_date>2022-07-11</Appointment_date>
    <Appointment_time>18:00:00</Appointment_time>
    <Patient_gender>male</Patient_gender>
  </Patient>
</Appointment>
